{
  "abiVersion": "renderer.oxideloop.dev/v0",
  "root": {
    "apiVersion": "apps.example.io/v1alpha1",
    "kind": "WebApplication",
    "namespace": "default",
    "name": "api",
    "uid": "root-uid-1",
    "generation": 1,
    "spec": {}
  },
  "bundleDigest": "sha256:test-bundle",
  "cacheEpoch": "0",
  "observationToken": "test-observation-token",
  "observations": []
}
